job_title,company,job_description,Link,resume,cover_letter,
Advisor,Ministry of Indigenous Affairs,"Do you have research and analysis skills to conduct environmental scans, assess current and proposed policy alternatives and anticipate emerging issues? Do you have consultation skills to work collaboratively with Indigenous partners and other government organizations? If so, here is the opportunity to support Indigenous projects and studies!\n\nThe Ministry\nThe Ministry of Indigenous Affairs provides corporate Indigenous policy development, management support, negotiates and settles land claims. It also manages the Province's relationships with First Nations, Indigenous organizations (including Métis, Native women, Inuit and off-reserve) and the federal government. As the corporate lead on Indigenous affairs within the Ontario Government, it provides Indigenous policy development and relationship expertise. It coordinates cross-ministry Indigenous policy initiatives and multi-lateral relationship processes. It is also responsible for the Aboriginal Policy Framework and other corporate coordination activities.\n\nOPS Commitment to Diversity, Inclusion, Accessibility, and Anti-Racism:\nWe are committed to build a workforce that reflects the communities we serve and to promote a diverse, anti-racist, inclusive, accessible, merit-based, respectful and equitable workplace.\n\nWe invite all interested individuals to apply and encourage applications from people with disabilities, Indigenous, Black, and racialized individuals, as well as people from a diversity of ethnic and cultural origins, sexual orientations, gender identities and expressions.\n\nVisit the OPS Anti-Racism Policy and the OPS Diversity and Inclusion Blueprint pages to learn more about the OPS commitment to advance racial equity, accessibility, diversity, and inclusion in the public service.\n\nWe offer employment accommodation across the recruitment process and all aspects of employment consistent with the requirements of Ontario's Human Rights Code. Refer to the ""How to apply"" section if you require a disability-related accommodation.\n\nWhat can I expect to do in this role?\nIn this role, you will:\n• conduct research and analysis to support a variety of projects\n• assist with the development of policies and program frameworks\n• identify issues, trends and their potential impact on ministry policies and programs\n• build and develop collaborative relationships with Indigenous partners\n• implement and manage transfer payment programs in collaboration with Indigenous communities and organizations\n• prepare a variety of correspondence and briefing materials\n\nHow do I qualify?\nKnowledge of Indigenous Peoples\nYou understand:\n• concepts, barriers and principles for engaging, consulting and building relationships with Indigenous partners, communities and organizations\n• historical, social, economic, legal, and political issues underlying Indigenous policy development\n\nPolicy and Program Development Skills\nYou have:\n• knowledge of policy and program development principles, practices and techniques\n• experience developing performance measures to effectively assess the impact of government policies and programs\n• experience managing complex and sensitive policy and/or program issues\n\nCommunication Skills\nYou can:\n• discuss policy options, strategies and issues with senior decision makers\n• prepare a variety of tools, resources and briefing materials for senior management\n• work collaboratively with internal partners, various levels of government as well as Indigenous stakeholders\n\nResearch and Analytical Skills\nYou can:\n• apply research methodologies and techniques to gather appropriate and reliable data from a variety of sources\n• evaluate qualitative and quantitative data to develop evidence-based policy options and recommendations\n• assess and evaluate proposed policies, recommendations and options to ensure they are feasible and align with the government and ministry priorities",https://www.gojobs.gov.on.ca/Preview.aspx?Language=English&JobID=205961,investigator_analyst_resume,,
Health Analyst,Ministry of Health,"Are you innovative with a strong background in conducting quantitative analysis in health?\n\nConsider this opportunity to lead and conduct a full range of health analysis using your skills and knowledge in such specialized areas as SAS, health geography, geographic information systems, statistics, and health system performance measurement.\n\nNote: The successful candidate will have the option of working from the following office locations:\n• Toronto Office: 56 Wellesley Street W., Toronto\n• Kingston Office: MacDonald-Cartier Bldg., 49 Place d'Armes, Kingston\n• London Office: 130 Dufferin Avenue, London\n• Sudbury Office: 159 Cedar Street, Sudbury\n\nOPS Commitment to Diversity, Inclusion, Accessibility, and Anti-Racism:\nWe are committed to build a workforce that reflects the communities we serve and to promote a diverse, anti-racist, inclusive, accessible, merit-based, respectful and equitable workplace.\n\nWe invite all interested individuals to apply and encourage applications from people with disabilities, Indigenous, Black, and racialized individuals, as well as people from a diversity of ethnic and cultural origins, sexual orientations, gender identities and expressions.\n\nVisit the OPS Anti-Racism Policy and the OPS Diversity and Inclusion Blueprint pages to learn more about the OPS commitment to advance racial equity, accessibility, diversity, and inclusion in the public service.\n\nWe offer employment accommodation across the recruitment process and all aspects of employment consistent with the requirements of Ontario's Human Rights Code. Refer to the ""How to apply"" section if you require a disability-related accommodation.\n\nWhat can I expect to do in this role?\nYou will:\n• lead, conduct and participate in health analytic research and analysis to support Ministry business needs for\nhigh quality information and methodological support that enable health system evidence-based decision making.\n\nHow do I qualify?\nTechnical Knowledge Skills:\nYou have demonstrated knowledge of:\n• theories, concepts, methods and measures of one or more of the following: epidemiology, health economics;\nhealth geography, biostatistics, population health, health system performance measurement and health status\nassessment, analytic methods, statistical techniques and modeling, quantitative research design, and methods\ngenerally used in health analytics to provide health analytic guidance and advice to clients regarding health\nsystem information products, reporting capabilities and tools.\n• Government/ministry directions and priorities, Division mandate, and ministry stewardship principles, legislative\nauthorities, regulations, corporate standards, policies and guidelines in the areas of IT, privacy, and information\naccess and distribution to ensure awareness and compliance in project activities.\n\nResearch, Analytical and Information Systems/Data Base Experience:\nYou have demonstrated knowledge:\n• conducting comparative analyses of alternative methodologies.\nIdentify, analyze, and resolve issues related to the use and interpretation of data and measures derived from it\nand identify issues related to the access, use, limitations and interpretation of health data.\n• analyzing the performance of the health system relative to identified performance metrics at provincial, LHIN and\nindividual program/portfolio levels.\n• health system and trends in health analytics, health planning and policy to support ministry evidence-based\ndecision making; to review, synthesize and appraise scientific literature.\n• information systems and business tools to define requirements, input, manipulate and conduct data retrievals\nfrom various health databases in order to align work with other approaches in the ministry, OPS or health care\nsystem; availability, uses, strengths and weaknesses of administrative and population health databases.\n• administrative and population health databases and statistical software and mainframe and PC computers to\ndesign and conduct integrated data analyses to meet health information and knowledge requirements and to\nconduct research and perform statistical analyses.\n\nCommunications, Relationship Management and Consultation Skills:\nYou have demonstrated skills in:\n• oral and written communications to produce status reports, compile and analyze technical data, make\npresentations, liaise and collaborate with branch staff, management and counterparts.\n• consultation and presentation skills to lead consultations with stakeholders who may have opposing needs and\npositions with regard to ministry policies, to influence/persuade stakeholders to consider alternative responses to\nan issue, and to provide leadership to project and work teams.\n• relationship management and customer service skills to resolve client service problems, to develop /maintain\nrelationships with clients, stakeholders and colleagues; and to participate on committees or working groups",https://www.gojobs.gov.on.ca/Preview.aspx?Language=English&JobID=207070,analytical_chemist_resume,, 
Laboratory Support Technologists,Ministry of the Solicitor General,"Would you like to be part of a team involved in conducting highly specialized forensic examinations and analyses? Ontario's Centre of Forensic Sciences is one of the most extensive forensic science facilities in North America. Working out of the state-of-the-art Forensic Services and Coroners Complex , you will provide first level technical and support services to the Center of Forensic Sciences laboratory functions. This includes integration of laboratory activities with quality assurance, consumables inventory and case sample management.\n\nOPS Commitment to Diversity, Inclusion, Accessibility, and Anti-Racism:\nWe are committed to build a workforce that reflects the communities we serve and to promote a diverse, anti-racist, inclusive, accessible, merit-based, respectful and equitable workplace.\n\nWe invite all interested individuals to apply and encourage applications from people with disabilities, Indigenous, Black, and racialized individuals, as well as people from a diversity of ethnic and cultural origins, sexual orientations, gender identities and expressions.\n\nVisit the OPS Anti-Racism Policy and the OPS Diversity and Inclusion Blueprint pages to learn more about the OPS commitment to advance racial equity, accessibility, diversity, and inclusion in the public service.\n\nWe offer employment accommodation across the recruitment process and all aspects of employment consistent with the requirements of Ontario's Human Rights Code. Refer to the ""How to apply"" section if you require a disability-related accommodation.\n\nWhat can I expect to do in this role?\n1. Organize and maintain laboratory sample storage areas including assisting with case sample inventory and management to keep storage locations organized.\n2. Sort, batch, and store items according to laboratory quality system requirements and section processes.\n3. Coordinate and package case specific items for return/transfer to investigating and partnered agencies or Sault Ste Marie or for disposal while maintaining chain of custody in our LIMS system\n4. Follow laboratory protocols, ensure Laboratory Information Management System (LIMS) is updated to reflect the chain of custody of evidentiary items.\n5. Receive and manage storage of laboratory supplies delivered to the Centre of Forensic Sciences and distribution to appropriate locations\n6. Communicate with CFS Business Unit staff, independently or when directed by management / scientific staff, to facilitate the purchasing of laboratory consumables and servicing of laboratory equipment.\n7. Handle potentially biohazardous material in accordance with universal safety precautions\n8. Enter data and retrieve data from the Laboratory Information Management System(LIMS)\n9. Collect used glassware from laboratories; cleaning and drying where necessary, sterilising glassware that may contain biological or chemical materials; redistributing clean glassware and relevant lab consumables to applicable laboratories.\n\n10. Prepare reagents/buffers/standards when required, maintain inventory and track expiry .\n11. Be exposed to, handling of biological samples that may be contaminated, exposure to unpleasant materials, odours, and content. (e.g. Liver sample preparation)\n12. Assist with other administrative or laboratory duties as required.\n\nNote: Manager has the right to assign additional duties/responsibilities as required.\n\nHow do I qualify?\nTechnical Skills and Laboratory Knowledge\n• You have knowledge of Laboratory Information Management System (LIMS to ensure chain of custody on case specific items is maintained.\n• Knowledge of WHIMIS and health and Safety protocols relating to chemicals and biohazardous material.\n• Knowledge of proper exhibit handling procedures to ensure evidentiary items are protected from loss, cross transfer, contamination and/or deleterious change.\n• Knowledge of universal precautions to work safely with biohazardous materials by applying known procedures and techniques. Including the use of personal protective equipment such as gloves, masks, gown and protective eyewear.\n• Knowledge of laboratory safety and awareness of the Occupational Health and Safety Act and regulations that apply to the work, and knowledge of any potential or actual danger to health or safety in the workplace.\n• Knowledge of procedures for cleaning, drying and sterilising laboratory glassware\n\nProblem Solving and Communication Skills\n• You can maintain accurate documentation and ability to communicate with associates regarding laboratory issues.\n• You have the skills to identify and follow up on issues/delays in maintaining, laboratory supply inventory, laboratory reagents, laboratory standards and laboratory controls).\n• You can perform calculations relating to the preparation of reagents, standards, and buffers and the ability to follow current Standard Operating Procedures\n• You can evaluate existing workflows and making recommendations to improve laboratory efficiency.\n• Job requires reasoning skills to determine approach to handling case materials and determine appropriate storage and disposal methods for items by consulting procedural manual.\n• You can label and document forensic evidence and specimens with a high degree of accuracy and consistency in order to provide undisputable continuity of evidence.\n\nAdministrative and other Essential Skills:\n• Knowledge of administrative / office procedures and guidelines such as processing invoices, ordering laboratory and office supplies, updating inventory and asset control lists and maintaining filing systems.\n• You have the ability to use computer software programs to produce letters, memoranda, reports, charts, tables, graphics and spreadsheets.\n• You can work independently and as part of a team. As required, urgent matters are escalated to management's attention and action where direct supervision may be minimal.\n• You can determine work priorities among conflicting demands and attention to details when maintaining chain of custody and managing various items.\n• You have the ability to determine when to re-order supplies and disposable equipment for the unit by regularly checking and evaluating inventory.\n• You possess manual dexterity skills required to prepare standards and transfer biological material using pipettes",https://www.gojobs.gov.on.ca/Preview.aspx?Language=English&JobID=203119,lab_technician_resume,,
Terrestrial Effects Scientist,"Ministry of the Environment, Conservation and Parks","The Ministry of the Environment, Conservation and Parks has an unique opportunity for an innovative environmental professional to provide scientific expertise and leadership in the design, conduct and interpretation of vegetation and soil surveys, monitoring programs and special studies that assess and communicates the impacts of environmental contamination and/or other environmental stressors on vegetation health ( plants, trees, crops) and soil quality.\n\nOPS Commitment to Diversity, Inclusion, Accessibility, and Anti-Racism:\nWe are committed to build a workforce that reflects the communities we serve and to promote a diverse, anti-racist, inclusive, accessible, merit-based, respectful and equitable workplace.\n\nWe invite all interested individuals to apply and encourage applications from people with disabilities, Indigenous, Black, and racialized individuals, as well as people from a diversity of ethnic and cultural origins, sexual orientations, gender identities and expressions.\n\nVisit the OPS Anti-Racism Policy and the OPS Diversity and Inclusion Blueprint pages to learn more about the OPS commitment to advance racial equity, accessibility, diversity, and inclusion in the public service.\n\nWe offer employment accommodation across the recruitment process and all aspects of employment consistent with the requirements of Ontario's Human Rights Code. Refer to the ""How to apply"" section if you require a disability-related accommodation.\n\nWhat can I expect to do in this role?\n•Lead the design and conduct of complex vegetation and soil surveys, monitoring programs, and/or special studies to assess and communicate the impacts of environmental contaminants and/or other environmental stressors on vegetation health (plants, trees, and crops) and/or soil quality\n•Prepare technical reports summarizing vegetation or soil surveys, monitoring programs, and/or special studies\n•Review and provide feedback/recommendations on the vegetation and soil components of third party assessments/surveys, monitoring programs, special studies, and/or risk assessments\n•Provide expert advice, technical and scientific information to ministry staff, senior management,the public, consultants, academia and related industry stakeholders\n•Lead a team of scientific/technical peers on special projects to obtain soil and vegetation related data in support of the ministry's standard setting and guideline development programs\n•Identify scientific knowledge gaps in our understanding of the effects of environmental contaminants and other environmental stressors on vegetation health and soil quality that warrant further study and suggest procedures and protocols to implement special studies\n\nHow do I qualify?\nMandatory\n•You have a valid Ontario Driver's License (Class G) to conduct field work as required\n•You have the ability to conduct field work, including field work that may involve multiple days in remote locations and/or involve difficult terrain.\n\nTechnical Knowledge\n•You have comprehensive knowledge of and are able to apply the theories and principles of plant science (e.g. plant physiology, phytotoxicology) and soil science\n•You have direct relevant experience assessing and interpreting the effects of environmental contaminants and/or other stressors on soil quality and vegetation health (i.e., plants, trees, crops)\n•You know the cause-effect relationships between environmental contaminants/stressors and vegetation and soil endpoints of concern to Ontario\n•You know the implications of plant air pollution sensitivities and pollution injury symptoms\n\nInvestigative, Risk Assessment, and Legislative Knowledge\n•You have knowledge of investigative theory, protocols and methodologies to design and conduct complex, innovative soil and vegetation surveys, monitoring programs, or special studies\n•You have the ability to provide expert advice on the soil and vegetation components of Environmental Assessments, risk assessments and third party soil and vegetation surveys and/or monitoring programs\n•You understand the principles, concepts, and approaches associated with risk assessment and management\n•You can properly apply relevant policies, regulations (e.g., O. Reg. 153/04 – Record of Site Condition), guidelines (e.g. Upper Limits of Normal, Ontario Typical Range, soil remediation guidelines), standards and legislation (e.g. Environmental Protection Act, Environmental Assessment Act)\n\nStatistical, Data Analysis, and Computer Knowledge\n•You have theoretical and practical knowledge of statistical methods, data modelling, data analysis, sources and types of analytical error/ uncertainty and associated computer applications/tools\n•You have experience using common computer systems and software, including word processing, spreadsheet, presentations, scientific graphing, statistical packages, and mapping programs (e.g., ArcGIS)\n\nLeadership, Project Management, and Analytical Skills\n•You demonstrate highly developed leadership and project management skills to initiate, lead and/or oversee projects and special studies\n•You can assess the scope of environmental emergencies or unique scientific problems and resolve them\n•You can evaluate and analyse complex scientific information involving multiple, interrelated and interdependent components\n\nCommunication, Relationship Management, and Organizational Skills\n•You can communicate highly technical information in a clear and logical manner to non-scientific and technical audiences\n•You can develop a variety of written products such as scientific reports, peer-reviewed journal articles, proposals, briefings, standard operating protocols/methods and study plans/designs\n•You have highly developed stakeholder relationship and interpersonal skills to represent the ministry on inter and intra-ministry working groups and to work effectively with internal staff, other ministry areas, and the public\n•You have the ability to effectively plan, organize, and manage time to accomplish multiple requests within competing deadlines",https://www.gojobs.gov.on.ca/Preview.aspx?Language=English&JobID=207227,program_analyst_resume,,
